{
  "round": 1,
  "target_commit": "01aa22f29de08f32abcd082c5d8cc523d67d2938",
  "auditor": {
    "session": "I5 auditor (stopped early at the human's request; partial round)",
    "family": "same",
    "counts_toward_convergence": false
  },
  "milestone": "M1",
  "attacks": [
    {
      "id": "A1",
      "category": "statement_fidelity",
      "tried": "Not finished before the stop (incomplete).",
      "result": "no_finding",
      "findings": []
    },
    {
      "id": "A2",
      "category": "gate_evasion",
      "tried": "Attack B (forged consumer outcome, rerun), attack A (co-location) and attack C; full gates passed.",
      "result": "finding",
      "findings": [
        "F-M1-03",
        "F-M1-04",
        "F-M1-05",
        "F-M1-06"
      ]
    },
    {
      "id": "A3",
      "category": "model_vs_code",
      "tried": "Initial principals and parameters checked against the facts (active [2,3], challengers [4], W/F/D 10/40/20); further rules not finished (incomplete).",
      "result": "no_finding",
      "findings": []
    },
    {
      "id": "A4",
      "category": "vacuity",
      "tried": "Covered by G11V; the vacuity probe did not report before the stop (incomplete). Attack D (a reachability label forged on an inhabitant that still checks) is gate evasion, not an unsatisfiable premise: filed under gate_evasion as F-M1-05.",
      "result": "no_finding",
      "findings": []
    },
    {
      "id": "A5",
      "category": "determinism",
      "tried": "Two full runs: 64 files each, identical after stripping 'seconds', identical to the committed outputs.",
      "result": "no_finding",
      "findings": []
    },
    {
      "id": "A6",
      "category": "mutation_adequacy",
      "tried": "Three new mutations: NM1_1 revert keeps rri, NM1_2 challenge without the in-challenge guard, NM1_3 finalize window off by one. NM1_3 moves L_disch_delay_wait to UNKNOWN; NM1_1 and NM1_2 move nothing.",
      "result": "finding",
      "findings": [
        "F-M1-01",
        "F-M1-02"
      ]
    },
    {
      "id": "A7",
      "category": "bindings_ledger",
      "tried": "A G2 probe was started when the audit was stopped (incomplete).",
      "result": "no_finding",
      "findings": []
    }
  ],
  "findings": [
    "F-M1-01",
    "F-M1-02",
    "F-M1-03",
    "F-M1-04",
    "F-M1-05",
    "F-M1-06"
  ]
}
